{
  "schema_id": "asklegal.hk-regulatory.source-decision-case",
  "schema_version": "1.0.0",
  "package_contract_version": "1.0.0",
  "case_id": "HKREG-DEC-SRC-026",
  "suite_layer": "EVIDENCE_TO_DECISION",
  "primary_checkpoint": "SOURCE_FACT_AUTHORITY",
  "frozen": true,
  "synthetic_evidence_class": "SYNTHETIC_NO_REAL_AUTHORITY",
  "contract_bindings": [
    {
      "contract_id": "asklegal.hk-regulatory.conformance-universe",
      "version": "1.0.0",
      "fingerprint": "sha256:08811f9115365b21637728a4a0ab3234cf320e6030f0be2213c24bdfbd72fa14"
    },
    {
      "contract_id": "asklegal.hk-regulatory.source-decision-case",
      "version": "1.0.0",
      "fingerprint": "sha256:8cde473a55a385308a5b82202edcf718a910715536c1d49398303c1fa7f18a79"
    }
  ],
  "synthetic_cutoff": "2026-08-24T00:00:00Z",
  "scope_id": "HKEX_CROSS_BOARD",
  "prior_state": "SYNTHETIC_ACCEPTED_PREDECESSOR",
  "primary_coverage_cell_ids": [
    "HKREG-COV-DSRC-026"
  ],
  "secondary_coverage_cell_ids": [],
  "pair_membership": null,
  "declared_input_inventory": [
    "source-evidence"
  ],
  "declared_reference_inventory": [
    "asklegal.hk-regulatory.conformance-universe",
    "asklegal.hk-regulatory.source-decision-case"
  ],
  "declared_expected_inventory": [
    "SOURCE_DECISION_REPORT"
  ],
  "assertion_scope": "MEMBERSHIP",
  "required_result_dimensions": [
    "AUTHORITY",
    "MEMBERSHIP",
    "OWNERSHIP",
    "PROCESSING",
    "SOURCE_FACTS"
  ],
  "evidence_packet_fields": [
    "artifact_component_count",
    "artifact_shared_between_boards",
    "assigned_evidence_only_use",
    "assigned_instance_count",
    "assigned_owner_scopes",
    "chinese_available",
    "chinese_state",
    "claimed_fact_codes",
    "complete_source_ids",
    "direct_approval_present",
    "direct_approval_required",
    "due_source_ids",
    "express_exclusion",
    "express_inclusion",
    "final_update_present",
    "fresh_source_ids",
    "historical_investigation_only",
    "identical_wording_across_boards",
    "inclusion_evidence_conflicting",
    "inclusion_evidence_missing",
    "inclusion_evidence_unreadable",
    "matching_current_product",
    "no_alert_only",
    "object_class",
    "observation_gap",
    "official_parent_supported",
    "optional_chinese_bounded_use",
    "optional_presentation_conflict",
    "ownership_conflict",
    "predecessor_exact_match",
    "prohibited_source_repair",
    "proposal_or_pending_document",
    "reconciled_source_ids",
    "required_english_complete",
    "single_view_completeness_inference",
    "source_artifact_final",
    "source_contract_material_change",
    "source_id",
    "standing_approval_framework",
    "supported_owner_scopes",
    "website_suggested_scope"
  ],
  "supporting_evidence_ranges": [
    "input/HKREG-DEC-SRC-026-source-evidence.json#facts"
  ],
  "rule_trace": [
    "HKREG-SOURCE-DECISION-001"
  ],
  "established_facts": [
    "SYNTHETIC_FACT_PACKET_DECLARED"
  ],
  "unresolved_facts": [],
  "permitted_equivalent_results": [],
  "critical_error_codes": [],
  "package_fingerprint": "sha256:08811f9115365b21637728a4a0ab3234cf320e6030f0be2213c24bdfbd72fa14",
  "title": "Official inclusion evidence identifies an appendix",
  "purpose": "`RULE_COMPONENT` with its exact board owner and hierarchy",
  "expected_decision": {
    "schema_id": "asklegal.hk-regulatory.source-decision-result",
    "schema_version": "1.0.0",
    "rule_id": "HKREG-SOURCE-DECISION-001",
    "case_id": "HKREG-DEC-SRC-026",
    "outcome": "PASS",
    "reason": "RULE_COMPONENT_CLASSIFIED",
    "accepted_fact_codes": [],
    "rejected_fact_codes": [],
    "membership": "RULE_COMPONENT",
    "owner_scope_ids": [
      "HK-REG-HKEX-MAIN-BOARD"
    ],
    "component_instance_count": 1,
    "blocked_scope_ids": [],
    "permitted_scope_ids": [],
    "source_contract_review_required": false,
    "english_investigation_required": false,
    "supported_no_change": false,
    "search_record_authorized": false,
    "embedding_authorized": false,
    "release_authorized": false,
    "serving_authorized": false,
    "external_effects": "NONE"
  },
  "evidence_packet": {
    "slot_id": "source-evidence",
    "state": "AVAILABLE",
    "path": "input/HKREG-DEC-SRC-026-source-evidence.json",
    "role": "MEMBERSHIP_EVIDENCE",
    "media_type": "application/json",
    "content_fingerprint": "sha256:c1d1cc9336cc2ec29db72a304026d603625755387cec83f70f26fea479429ae6"
  },
  "facts": {
    "source_id": null,
    "claimed_fact_codes": [],
    "source_artifact_final": true,
    "due_source_ids": [],
    "complete_source_ids": [],
    "fresh_source_ids": [],
    "reconciled_source_ids": [],
    "single_view_completeness_inference": false,
    "optional_presentation_conflict": false,
    "source_contract_material_change": false,
    "final_update_present": false,
    "matching_current_product": false,
    "standing_approval_framework": false,
    "proposal_or_pending_document": false,
    "direct_approval_required": false,
    "direct_approval_present": false,
    "predecessor_exact_match": false,
    "no_alert_only": false,
    "observation_gap": "NONE",
    "historical_investigation_only": false,
    "object_class": "APPENDIX",
    "express_inclusion": true,
    "express_exclusion": false,
    "assigned_evidence_only_use": false,
    "inclusion_evidence_missing": false,
    "inclusion_evidence_unreadable": false,
    "inclusion_evidence_conflicting": false,
    "supported_owner_scopes": [
      "HK-REG-HKEX-MAIN-BOARD"
    ],
    "assigned_owner_scopes": [],
    "assigned_instance_count": 0,
    "artifact_component_count": 1,
    "artifact_shared_between_boards": false,
    "identical_wording_across_boards": false,
    "ownership_conflict": false,
    "official_parent_supported": true,
    "website_suggested_scope": null,
    "required_english_complete": true,
    "chinese_available": false,
    "chinese_state": "NONE",
    "prohibited_source_repair": false,
    "optional_chinese_bounded_use": false
  },
  "case_fingerprint": "sha256:f13d17b2dc0cb4ac1545c0e8266eeab849bfa2d70e17fc5af9af5681eb8e5cca"
}
